{
    "clientId": "GET THIS FROM https://dev.twitch.tv/console/apps",
    "clientSecret": "GET THIS FROM https://dev.twitch.tv/console/apps",
    "scopes": [
        "chat:read",
        "chat:edit",
        "moderator:read:followers",
        "moderator:manage:banned_users"
    ],
    "redirectPort": 7270
}
